{
  "schema_version": "1.0.0",
  "trace_map_id": "trace_map_prd_pm_lifecycle_visibility",
  "workspace_id": "ws_productos_v2",
  "artifact_id": "prd_pm_lifecycle_visibility",
  "artifact_type": "prd",
  "entity_links": [
    {
      "entity_type": "feature",
      "entity_id": "feature_item_lifecycle_traceability",
      "link_reason": "The PRD specifies the initial scope for this feature."
    },
    {
      "entity_type": "outcome",
      "entity_id": "outcome_pm_end_to_end_traceability",
      "link_reason": "The PRD targets this lifecycle-visibility outcome."
    }
  ],
  "evidence_refs": [
    {
      "source_type": "other",
      "source_id": "validation_lane_report_pm_lifecycle_visibility",
      "justification": "The validation lane report confirms that the PRD passed review and testing."
    },
    {
      "source_type": "other",
      "source_id": "manual_validation_record_pm_lifecycle_visibility",
      "justification": "Manual validation approved the discovery package for handoff."
    }
  ],
  "upstream_artifact_ids": [
    "problem_brief_pm_lifecycle_visibility",
    "concept_brief_pm_lifecycle_visibility",
    "prototype_record_pm_item_timeline"
  ],
  "change_notes": [
    "PRD trace added for end-to-end lifecycle auditability."
  ],
  "created_at": "2026-03-23T10:41:00Z"
}
