{
  "schema_version": "1.0.0",
  "trace_map_id": "trace_map_concept_brief_pm_lifecycle_visibility",
  "workspace_id": "ws_productos_v2",
  "artifact_id": "concept_brief_pm_lifecycle_visibility",
  "artifact_type": "concept_brief",
  "entity_links": [
    {
      "entity_type": "feature",
      "entity_id": "feature_item_lifecycle_traceability",
      "link_reason": "The concept introduces this feature direction."
    },
    {
      "entity_type": "opportunity",
      "entity_id": "opp_pm_lifecycle_traceability",
      "link_reason": "The concept is the proposed response to this opportunity."
    }
  ],
  "evidence_refs": [
    {
      "source_type": "other",
      "source_id": "idea_record_pm_lifecycle_visibility",
      "justification": "The idea record is the direct upstream source for the selected concept."
    }
  ],
  "upstream_artifact_ids": [
    "idea_record_pm_lifecycle_visibility",
    "problem_brief_pm_lifecycle_visibility"
  ],
  "change_notes": [
    "Trace map added so concept lineage remains visible in audits."
  ],
  "created_at": "2026-03-23T10:11:00Z"
}
