{
  "schema_version": "1.0.0",
  "trace_map_id": "trace_map_problem_brief_pm_lifecycle_visibility",
  "workspace_id": "ws_productos_v2",
  "artifact_id": "problem_brief_pm_lifecycle_visibility",
  "artifact_type": "problem_brief",
  "entity_links": [
    {
      "entity_type": "problem",
      "entity_id": "problem_pm_discovery_visibility_gap",
      "link_reason": "The brief formalizes this problem statement."
    },
    {
      "entity_type": "opportunity",
      "entity_id": "opp_pm_lifecycle_traceability",
      "link_reason": "The opportunity exists to resolve this visibility gap."
    }
  ],
  "evidence_refs": [
    {
      "source_type": "other",
      "source_id": "research_notebook_pm_lifecycle_visibility",
      "justification": "The notebook supplies the evidence synthesis behind the problem framing."
    }
  ],
  "upstream_artifact_ids": [
    "research_notebook_pm_lifecycle_visibility",
    "competitor_dossier_pm_lifecycle_visibility",
    "market_analysis_brief_pm_lifecycle_visibility"
  ],
  "change_notes": [
    "Trace map created for V5 discovery auditability."
  ],
  "created_at": "2026-03-23T10:06:00Z"
}
